{"query":"knowledge","scope":"trusted-local","filters":{"kind":null,"subtype":null,"visibility":null,"record_status":null,"workflow_stage":null,"maturity":null,"review_status":null,"tags":[],"role":null},"limit":20,"index_versions":{"projection":2,"tokenizer":1,"segment_algorithm":1},"hits":[{"classification":{"kind":"note","subtype":"idea","role":"human"},"path":"notes/ideas/example.md","object_id":"note_01JSTAG7N9Q3V5X8Y2Z4A6B8D0","section_id":"sec_core_idea","segment_id":"seg_aaaaaaaaaaaaaaaaaaaaaaaaaaaaaaaaaaaaaaaaaaaaaaaaaaaaaaaaaaaaaaaa","ordinal":0,"title":"Example","snippet":"Knowledge matters.","score":-1.0,"tags":["idea"],"visibility":"private","record_status":"active","citations":[]}],"count":1}
